{
  "receipt_version": "aweb.agent_receipt.v0.1",
  "receipt_id": "aweb-example-xrpl-001",
  "example": true,
  "created_at": "2026-05-27T20:48:00Z",
  "scope": "payment_preparation",
  "authority": {
    "grant_id": "grant.xrpl.payment.simulated.001",
    "mode": "prepare",
    "authorized_by": "operator:daniel-wahnich",
    "policy_profile": "payment_preparation_only.no_broadcast",
    "allowed_actions": [
      "prepare_payment_context",
      "estimate_fee",
      "record_policy_checks"
    ],
    "denied_actions": [
      "sign_transaction",
      "broadcast_transaction",
      "move_user_funds"
    ]
  },
  "agent": {
    "agent_id": "aweb.payment.receipt_reviewer",
    "model_class": "reasoning_agent",
    "operator": "Aweb Labs"
  },
  "workflow": {
    "workflow_id": "wf.xrpl.payment_receipt_demo",
    "intent": "Prepare a payment-adjacent receipt without signing or broadcasting a transaction.",
    "environment": "simulated",
    "network": "xrpl-testnet-placeholder"
  },
  "capability": {
    "provider": "xrpl",
    "tool": "payment_context_preparer",
    "category": "payment_evidence",
    "mcp_provider": "simulated.xrpl.payment_reader"
  },
  "execution": {
    "status": "needs_human_review",
    "started_at": "2026-05-27T20:48:02Z",
    "finished_at": "2026-05-27T20:48:07Z",
    "idempotency_key": "xrpl-example-001",
    "cost": {
      "amount": 0.0,
      "unit": "USD",
      "note": "No signed or broadcast payment."
    },
    "payment_status": "prepared_not_signed",
    "recovery_state": "Requires explicit human approval and wallet signature outside this example."
  },
  "evidence": {
    "summary": "The receipt captures payment intent, policy checks, fee estimate, destination redaction, and no-broadcast state.",
    "payment_context": {
      "source_account": "redacted",
      "destination_account": "redacted",
      "asset": "XRP-testnet-placeholder",
      "amount_class": "small_test_value",
      "fee_estimate": "placeholder",
      "transaction_hash": null,
      "broadcast": false
    },
    "artifacts": [
      {
        "type": "payment_policy_check",
        "ref": "artifact://simulated/xrpl/payment-policy-001",
        "redacted": false
      },
      {
        "type": "prepared_transaction",
        "ref": "artifact://simulated/xrpl/prepared-transaction-001",
        "redacted": true,
        "reason": "Prepared payment details include private account context."
      }
    ]
  },
  "privacy": {
    "redaction_policy": "payment_counterparty_redacted",
    "redacted_fields": [
      "raw_prompt",
      "source_account",
      "destination_account",
      "prepared_transaction",
      "provider_credentials"
    ],
    "disclosure": "Policy status and no-broadcast state are visible; account details are redacted."
  },
  "review": {
    "trust_state": "prepared_not_executed",
    "human_review_required": true,
    "review_notes": [
      "This fixture is designed to avoid unsafe payment automation claims.",
      "Reviewer can see that the agent prepared context only and did not sign or broadcast.",
      "A funded milestone should add a real XRPL testnet example with explicit safety boundaries."
    ]
  }
}
